<?xml version="1.0" encoding="UTF-8"?>
<!--
/**
 * Copyright © Magento, Inc. All rights reserved.
 * See COPYING.txt for license details.
 */
-->
<xs:schema xmlns:xs="http://www.w3.org/2001/XMLSchema">
    <xs:element name="config">
        <xs:complexType>
            <xs:sequence>
                <xs:element name="type" type="logGroupType" minOccurs="1" maxOccurs="unbounded"/>
            </xs:sequence>
        </xs:complexType>
    </xs:element>

    <xs:complexType name="logGroupType">
        <xs:sequence>
            <xs:element name="field" type="fieldType" minOccurs="1" maxOccurs="unbounded"/>
        </xs:sequence>
        <xs:attribute name="name" type="xs:string" use="required"/>
    </xs:complexType>

    <xs:complexType name="fieldType">
        <xs:attribute name="name" type="xs:string" use="required"/>
        <xs:attribute name="required" type="xs:string" use="required"/>
        <xs:attribute name="type" type="xs:string" use="required" />
        <xs:attribute name="sortOrder" type="xs:integer" use="required" />
    </xs:complexType>
</xs:schema>
